,Title,Link,Corpus,category,author,timeanddate,sentiment
43,Homeschoolers flock to this small Christian college that counters Ivy League's culture,https://www.foxnews.com/us/homeschoolers-flock-small-christian-college-counters-ivy-leagues-culture,homeschoolers flock christian college counters ivy league ’ culture small christian college large home-school population challenging liberal university norms focusing classi education small christian college large home-school population challenging norms liberal elite universities returning education sanity founder sat alternative told abundance people college degrees jeremy tate founder classic learning test told scarcity people kind work ethic kind integrity employers looking right home-schooled students thrive christian college exam founder says watch videowatch digital originals heretate former college counselor patrick henry college well-rounded graduates stronger work ethic peers traditional schools better disciplined chalked success faith-based conservative college large home-school population on-campus device ban dress code students 're forming young people right ways tate return sanity return common sense academic rigor lessons american founding biblical worldview commitments sets patrick henry college apart college world phc spokesperson told phc prepares graduates make immediate enduring impact christ liberty mother pulled kids public school woke curriculum says home-schooling produces ‘ amazing ’ resultsat patrick henry 75 students enrolled home-schooling finished high school according phc spokesperson tate whose company administers alternative standardized test sat act college entrance home-school students took clt exam surpassed peers test home-schoolers earned average scores roughly 78 points private charter school students scored 75 73 respectively according houston professor analysis clt data 2016 2021. public school students scored lowest average score 66. home-school students surpassing peers tate alternative college entrance exam called classic learning test istock home-schoolers ways kind charts tate concentration college … college able take education expand patrick henry getting students coming college great base great foundation continued 're able offer program deep core knowledge deep humanities students graduate 're killing lsat 2021 graduating seniors patrick henry took law school admission test lsat scored 171 average — 98th percentile nation school spokesperson undergraduates nation top-rated colleges averaged 171 higher according u.s. world report.marymount university students launch protests school axes majors like math english religious studiestexas mother home-schooled kids says produces ‘ amazing ’ results watch videotate students drawn schools like patrick henry college focus classical education unlike many universities patrick henry n't fixate social justice woke curricula.nationwide college enrollment decreased 4.2 since 2020 according national student clearinghouse research center patrick henry college seen surge applicants since 2017 according university spokesperson tate college rules help success walk around campus rule 're devices class n't touch devices tate whereas sit typical lecture hall big public universities two-thirds kids 're scrolling tiktok instagram whole time declining test scores social skills caused school boards teachers unions mother says tate says patrick henry college focus classical education return sanity compared woke curriculum liberal universities digital patrick henry students adhere dress code compare lot college campuses right like every day seems pajama day tate really changes culture click apptate told one-third staff patrick henry graduates ca n't hire enough tate think employers really want want ethically grounded hardworking [ ] disciplined young people watch tate full interview click megan myers associate producer/writer digital originals,us,," March 18, 2023 12:00pm EDT",positive
44,The FBI took her life savings. Now she’s fighting to help others get theirs back.,https://www.foxnews.com/us/fbi-took-life-savings-now-fighting-help-others-get-back,"fbi took life savings ’ fighting help others back linda martin hundreds others life savings seized fbi raid california safe deposit company years later seeking justice.linda martin thought responsible putting nest egg safe deposit box ’ tempted touch never imagined fbi would seize life savings n't tell us took money n't told us anything far wrong martin 58 told n't done anything wrong work saved money trying save buy house years later martin still ’ know money taken ’ ever back fbi took life savings n't charged hear story videowatch digital originals fbi feel like away anything feel like unfair 22 2021 fbi seized martin 1,400 customers safe deposit boxes u.s. private vaults beverly hills–based company fbi took 40,200 linda saving payment home addition another 86 million cash tens millions gold silver jewelry valuables safe deposit box renters martin found raid watching local husband could n't believe martin really n't believe sat start watching fbi raiding private vault place several months later received notice stating fbi wanted keep money process known civil forfeiture confused legal jargon martin chose file petition bureau first option listed notice without realizing conceded property could forfeited consequently allowing fbi determine could money back.martin told n't received determination.she knowledge assets taken charged even suspect crime rather fbi investigating u.s. private vaults shut following raid pleaded guilty conspiracy launder drug money linda martin filing class-action lawsuit recover life-savings seized safe deposit box fbi 2021 raid unfortunately legal institute justice attorney bob belden told civil forfeiture process united states law enforcement take property people never charged crime last week martin institute justice filed putative nationwide class action lawsuit seeking help anyone property taken government agency last six years received deficient forfeiture notice former fbi agent convicted accepting 150k bribes provide confidential informationaccording fbi notice martin received life savings taken administrative forfeiture action tariff act 1930 allows federal agencies seize property without judicial involvement really system agency prosecutor judge jury belden governor president thinking giving pardon types forfeitures law enforcement needs probable cause property somehow connected crime order seize linda case good example standard real life somewhat meaningless fbi applied seizure warrant u.s. private vaults 2021 fbi united states attorney ’ office application agents would merely inventory box renters ’ property warrant would authorize seizure nests boxes contents according institute justice review court documents using federal forfeiture records institute justice calculated 2017 2021 department justice agencies took 8 billion forfeitures fbi receiving 1.19 billion irfan khan / los angeles times via getty images fbi united states attorney ’ office n't tell judge months prior already planned use civil forfeiture seize assets customers ’ boxes worth 5,000 fbi ’ minimum monetary threshold forfeitures according findings institute justice developed probable cause mind knew anything single box owner belden told fbi raids trump mar-a-lago 'unprecedented agency execute search warrant former presidentan fbi spokeswoman previously bureau broadly seized safe deposit boxes u.s. private vault based allegations widespread criminal wrongdoing seizure fell within bounds warrant martin never received explanation.additionally government agencies stand gain types raids according belden agency submits seized property department justice ’ assets forfeiture fund money returned agency pay costs associated accomplishing legal forfeiture property according doj belden means money agency pocket big incentive told big incentive forfeit property using federal forfeiture records institute justice calculated 2017 2021 department justice agencies took 8 billion forfeitures fbi receiving 1.19 billion that.in previous class-action lawsuit institute justice filed judge ruled favor group safe deposit box holders found notices administrative forfeiture sent fbi provide enough information plaintiffs property seized judge ordered fbi return property named lawsuit send detailed notice administrative forfeitures fbi returned property doj sued refusing explain ignored protests supreme court justices homes 've taken calling ‘ take-now explain-never forfeiture ’ belden fbi seized estimated 86 million cash hundreds safe deposit boxes u.s. private vaults 2021 raid al seib / los angeles times via getty images linda idea think wrong belden illustrates think happening hundreds thousands people states throughout country martin chose file class action lawsuit hope retrieving property property anyone fallen victim administrative forfeiture click app felt misled felt angry martin told 'm advocating everyone lot people n't know 're trying justice added.the fbi u.s. attorney central district california responded request comments.to watch full interview martin belden click editor note article updated include comments fbi u.s. attorney central district california provided publication teny sahakian associate producer/writer follow teny twitter tenysahakian",us,," March 18, 2023 8:00am EDT",positive
45,"Maria Bartiromo breaks down the justice system double-standard with Rep James Comer, Sen Tom Cotton, and more",https://www.foxnews.com/media/maria-bartiromo-breaks-down-justice-system-double-standard-rep-james-comer-sen-tom-cotton,rep. james comer biden family financial findings ‘ beginning ’ house oversight committee chair james comer details findings biden family financial records ‘ america reports ’ chairman james comer reveals china may gotten biden familymaria bartiromo congressman let go bank records really first batch bank records able 've stonewalling james comer many maria deal think many 11 deals n't know deals bidens beginning white house denied knowledge fact family involved sort way shape form ccp bank records reveal otherwise n't know bidens return money lawyer c capital business n't able find business maria 're going opportunity ask people closely aligned biden family 've talked privately 'm going reveal say privately soon 'll either talking everyone form deposition even better committee hearing right looks like biden family pocketed money deal 11 go 'm pretty confident 'll getting bank records soon maria bartiromo right 1 million distributed bidens deal say 11 others let talk possibly ccp could paying 're indication whether laptop investigation gives us information specifically china paying biden family james comer well know president vice president obama administration made several trips china brought son associates met different places people president claimed never met know president n't truthful involvement vice president talking former associates involved hunter biden know biden family agreed help china foot door american energy industry purchased liquefied natural gas purchased interest drillers natural gas well try things like help china buy farmland biden blast honduras joins list countries ties china 'where smoke fire'jonathan turley tells maria trump ’ possible indictment ‘ overtly political ’ maria bartiromo questions mean president trump number going true standards justice john turley well maria ironically donald trump choose cases would come first would case case overtly political really fulfills narrative many raised campaign season ways fortunate decision trump brag gave donald trump think credible evidence politicalization criminal justice system might difficult time something like mar lago question happens case could picked better jurisdiction prosecute donald trump know worst possible jury pool judges york dismiss case like would border self-immolation possible could go trial going serious problems appeal think 'm convinced barack run time think significant questions whether statute limitations already run claims rep byron donalds calls hearings capitol hill regulators ’ treatment banking systemmaria bartiromo well mean look week ago fdic told us going secure deposits signature bank silicon valley bank know number banks want treatment securing deposits mentioned mary daly president san francisco federal reserve kim strassel wall street journal writes great op ed week esg help sink sbb day administration talking climate change agenda whole government approach maybe rewarding sbb policies around esg around climate change agenda rather focusing safety bank charles payne deconstructs 'major excuse trump deregulation led silicon valley bank collapsebyron donalds totally agree thought process mary daly needs probably come capitol hill explain us looking 're solely focused climate change equity agendas stuff 're concerned interest rate risk balance sheet bank 're job serious questions regulators respect soundness banking system let add maria let absolve executives silicon valley bank n't risk manager apparently eight months risk officer excuse c-suite known better done needed manage interest rate risk bank going long treasuries like mortgage backed securities make sure ca n't let look fed give pass view federal reserve took long trying inflation economy everybody bearing burden dithering respect handling inflation videosen tom cotton discusses biden administration protected chinese depositsmaria bartiromo want take fdic securing deposits bank including importantly many companies based china clients silicon valley bank 're saying look ca n't secure deposits everywhere fast come rescue silicon valley bank even clients china wonder would treatment bank texas clients oil companies oil know trading firms tom cotton well maria ask question think carrying answer think obvious everyone joe biden would bailed bank say midland texas banked almost exclusively oil gas industry failure silicon valley bank stress put banking sector economy really joe biden failures way joe biden reckless spending created runaway inflation led higher interest rates put squeeze banks like silicon valley bank joe biden administration n't properly oversee supervise bank like silicon valley bank six months ago year ago ensure proper risk management interest rate spreads deposits hand assets hand matter last week n't help arrange shotgun wedding merger larger bank stable balance sheet probably 're ideologically opposed kind mergers got instead biden bank bailout fact going chinese companies well known silicon valley bank access point chinese companies american money bank failures foreign depositors supposed line behind american depositors yet biden administration confirmed conference call last week situation fact going make whole chinese depositors probably fig leaf know single american cosigner likely venture capital firms funneling money chinese companies first place companies almost certainly cases aligned chinese communist party people liberation army videojohn ratcliffe tells maria bartiromo presumption innocence trump since mueller investigation beganmaria bartiromo president trump says going arrested tuesday reaction legal expert torches manhattan da potential trump arrest 'banana republic sort stuff'john ratcliffe well clearly political prosecution underscored fact maria melvyn bragg d.a involved someone first day office prosecute armed robberies office saying prosecute misdemeanor offense opposition political party happens presidential candidate former president united states despite fact statute limitations clearly run misdemeanor fact state federal prosecutors passed take maria latest sort evolution democrats shifted party democrats progressives really kind mix socialists communists n't like american justice system continuation assault justice system tearing pillars make system work well remind viewers mueller investigation going first pillars go bedrock principle presumption innocence remember donald trump n't presumption conclusively prove innocence quickly shifted ukraine impeachment suspension principle due process law donald trump became first president never allowed legal representation throughout house proceedings recently mar lago next principle go equal protection law saw statute applied trump biden regarding classified documents trump home raided biden lawyers allowed casually turn documents whenever want latest sort tortured prosecution offing week day york sort latest assault american justice system democratic party videosen rick scott warns double-standard system justicemaria bartiromo senator outrage republicans trump going indicted tuesday days james comer exposed money coming communist china distributed biden family click apprick scott mean first lot democrats hate trump republicans hate trump guess double standard anything want trump everybody okay ca n't biden completely double standard 're trump standard go attack guy everybody okay know people okay biden oh got careful got follow law americans fed press mean doj fbi many things federal government know double standard wrong well,media,," March 19, 2023 1:12pm EDT",positive
46,Biden admin moves to shut down another mine over eco concerns amid green energy push,https://www.foxnews.com/politics/biden-admin-moves-shut-down-mine-eco-concerns-green-energy-push,"biden warns climate change 'damning entire generation 'mother nature let wrath seen president biden young people motivated act climate change describing future dire terms 'the daily show 'the biden administration moved closer implementing 20-year ban mining south dakota forest area due proximity cultural natural resources.in joint announcement friday bureau land management blm forest service would consider 20-year withdrawal 20,574 acres located black hills national forest near pactola reservoir rapid creek watershed proposed action prohibits mining claims issuance federal mineral leases years agencies review proposal whether ’ northern minnesota southern arizona alaska south dakota sorts land restrictions anti-mining biden administration hamstring domestic development minerals need national defense energy technology everyday life rep. pete stauber r-minn. chairman house natural resources energy mineral subcommittee told digital need using resources workforce taking offline continued.biden turns country documented child labor issues green energy mineral supplies 'it egregious rep. pete stauber r-minn. blasted proposed action saying u.s. needs using resources workforce taking offline caroline brehman/cq-roll call inc via getty images according announcement action could protect drinking water supply nearby rapid city south dakota ellsworth air force base adverse impacts mineral exploration development.the agencies officially publish proposal 21 opening 90-day public comment period stakeholders able weigh action federal law interior secretary deb haaland authorized withdraw public lands mining leasing 20 years biden admin issues 20-year mining ban turns foreign supply chain amid green energy push blm pleased work usda forest service effort blm director tracy stone-manning statement proposal help protect primary source drinking water south dakotans forest service assesses 20-year withdrawal ’ going study feasibility withdrawing lands area activity might affect critical resources deserves thorough review forest service chief randy moore added bison grazes near black hills national forest custer south dakota july 8 2020 eric baradat/afp via getty images potential 20-year withdrawal comes amid multi-year approval process gold exploration project area proposed minneapolis-based mining company f3 gold comes months forest service issued draft decision allowing company explore across 3 acres build infrastructure several restrictions extensive environmental review.f3 gold pledged would n't extract water rapid creek watershed would n't use hazardous chemicals adding would never commence project poses risks regional water sources made series land use ecological stewardship commitments green energy projects face stark environmental local opposition nationwidethe company stated so-called jenny gulch exploration drilling project would produce precious metals necessary green energy technology like solar panels electric vehicle batteries aerospace equipment telecom equipment gold everywhere company states website due versatile properties vital component technologies nearly every economic sector u.s. making strategic critical future addition several companies expressed interest conducting exploratory drilling area lithium another key component electric vehicle batteries uranium vital zero-emissions nuclear power copper silver deposits found black hills bureau land management director tracy stone-manning listens senate hearing june 8 2021 ap photo/alex brandon agree renewable energy key fighting climate change think black hills good location large-scale mines black hills clean water alliance local eco group states website mining major contributor carbon emissions climate change black hills ecologically culturally historically unique treaty homelands lakota people current local economy based agriculture tourism outdoor recreation far prosperous mining-based economy creates far less damage area ’ land wildlife water friday blm forest service acknowledged announcement responsible development domestic mineral supplies important transitioning clean energy economy important protect natural resources.click appoverall u.s. produced 170 metric tons gold 2022 despite vast reserves precious metal federal data showed comparison china mined 330 metric tons gold exceeding production levels every country second consecutive year.the international energy agency repeatedly warned aggressive green energy goals met nations shore critical mineral supply chains green energy technologies like electric vehicle batteries solar panels wind turbines dependent lithium cobalt copper nickel graphite zinc precious metals like gold silver thomas catenacci politics writer digital",politics,," March 18, 2023 9:00pm EDT",positive
47,Newsom makes abrupt reversal after tough talk on Big Oil,https://www.foxnews.com/politics/newsom-makes-abrupt-reversal-tough-talk-big-oil,gavin newsom ripped fleeing 'personal trip snowstorm slammed california 'outnumbered panel slams california gov gavin newsom taking 'personal trip massive snowstorm hit state.democratic california gov gavin newsom made sudden reversal week effort hit oil companies price gouging penalties amid record-high gas prices energy crisis.newsom thursday unveiled proposal creating watchdog arm within california energy commission cec would monitor daily petroleum market price fluctuations ensure market participants play rules proposed cec office would granted broad authorities analyze refinery data subpoena information directly refer cases state attorney general ’ making major progress legislature hold big oil accountable fleecing californians pump newsom statement coalition representing hundreds organizations local leaders backing proposal impose strong effective oversight measures oil companies momentum side done california families ’ asking simple transparency accountability drive oil industry shadows continued ’ time choose whether stand california families big oil fight make play rules california gov newsom latest war oil rough start democratic california gov gavin newsom making major progress legislature revised proposal punish big oil high prices tom williams/cq-roll call inc via getty images however governor branded proposal stronger action represents pared-back version separate proposal punish oil companies ultimately could indefinitely delay implementation state price-gouging penalty newsom aggressively pushed according sacramento bee.california grid faces collapse leaders push renewables electric vehicles experts sayin december newsom announced aggressive actions punish oil companies lying gouging californians line pockets comments came called state legislature develop legislation cracking excessive energy price increases called california senate committee energy utilities communications hold hearing topic.the legislation newsom backed would hit companies financial penalty found increase gasoline prices excessively however legislation hit significant roadblocks experts state lawmakers including democratic leaders expressed concern would unintended consequences impacting consumers worker walks past pump jacks operating kern river oil field bakersfield california ap photo/jae c. hong enacting sbx1-2 best interests consumer reduce retail pump prices best long-term economic interests california michael mische professor university southern california marshall school business hearing last month better alternatives enacting reduce supply force producers reduce employment high-paying sector mische continued adding gas energy prices would increase result bill.democratic state sen. steve bradford argued hearing lawmakers must ensure actions take first [ ] harm consumers click appover course last year california consistently recorded highest average gas prices state even surging past 6 per gallon june october according data energy information administration although pump prices fallen considerably state last months average 4.87 per gallon still far highest nation.newsom office n't respond request comment thomas catenacci politics writer digital,politics,," March 17, 2023 3:32pm EDT",positive
