,Title,Link,Corpus,category,author,timeanddate,sentiment
76,Texas Whataburger employees' tip leads to man's arrest for indecency with a child,https://www.foxnews.com/us/texas-whataburger-employees-tip-leads-mans-arrest-indecency-child,"storm system moves towards dallas texas juan rodriguez took drone storms moving downtown dallas oak cliff.a texas man arrested last week employees whataburger reported police fast food restaurant juvenile situation seem right according police.in facebook post friday texarkana texas police department posted received 911 call employees whataburger restaurant boston road noon tuesday michael jerome clark sr. booking photo bi-state detention center told us juvenile girl older man eating together something ’ seem right situation post read started trying figure going became increasingly obvious instincts spot texas sheriff tells congress county ‘ siege ’ department shares migrant smuggling casesan investigation revealed man identified 79-year-old michael clark 13-year-old girl barely knew other.police 13-year-old girl clark offered money exchange sexual favors earlier day touched inappropriately previous encounter weeks prior whataburger restaurant texas istock tuesday police added girl walking street clark picked took whataburger.texas teen sentenced 45 years prison uber eats murderrepresentatives fast food chain immediately respond inquiries regarding matter.after investigating situation detectives obtained warrant clark arrested wednesday charges indecency child solicitation prostitution.he currently held 225,000 bond.click app greg wehner breaking reporter digital",us,," March 19, 2023 5:48pm EDT",positive
77,"Black history through the years: Rosa Parks, Sojourner Truth, MLK Jr. and other famous figures in the US",https://www.foxnews.com/lifestyle/black-history-10-famous-figures-us,"‘ faulkner focus ’ black history month ... interview bring americans together former olympian john carlos former nfl player jack brewer join harris faulkner ‘ faulkner focus ’ black history u.s. dates back 1619 enslaved africans brought jamestown colony — present-day williamsburg virginia since black americans persevered despite enormous challenges throughout nation ’ history able leave mark american culture every february nation celebrates black history month honoring contributions african americans recognizing fight racial justice continues today.black history month quiz test knowledge month tributethe theme february black resistance festivals events occurring community centers across u.s. according association study african american life history.from trailblazing abolitionists scientists artists politicians judges civil rights leaders numerous historical figures done part shape america country today.here 10 famous figures impactful contributions made years.1 sojourner truthsojourner truth born 1797 name isabella baumfree ulster county york — slavery still legal time escaped freedom 1826 infant daughter owner refused comply gradual abolition slavery law york passed national parks service reports baumfree later freed son sold alabama slave owner bringing case court black history month facts 10 things know 1828 became first black woman win case former slave owner.almost decades later baumfree joined methodist church changed name sojourner truth traveled country promote abolition slavery advancement women ’ rights religious tolerance baumfree famously delivered ’ woman speech 1851 ohio women ’ rights convention met president lincoln 1864 work national freedmen ’ relief association dictated group memoirs published book narrative sojourner truth northern slave 1850 .2. frederick douglass portrait frederick douglass born slavery 1818 istock frederick douglass american abolitionist orator born enslaved person february 1818 talbot county maryland became national leader abolitionist movement york massachusetts escaping bondage disguised sailor according library congress douglass delivered moving speeches essays experience anti-slavery stance including slave fourth july speech 1852 life times frederick douglass autobiography 1881 black patriotism us history example remember black history monthdouglass fought civil reforms including equal treatment black americans women free public education end capital punishment 3 harriet tubman harriet tubman american abolitionist leader 1820-1913 escaped slavery marrying free man led many slaves safety use abolitionist network known underground railroad mpi/getty images harriet tubman conductor underground railroad union army spy born 1822 dorchester county maryland name araminta ross changed name 1844 following marriage john tubman free man national parks service reports five years marriage tubman escaped freedom philadelphia slavery abolished tubman personally made 13 trips maryland free companions provided map freedom 70 tubman spent next decade life rescuing family friends known underground railroad personally made 13 trips maryland free companions provided map freedom 70 according nps time american civil war broke 1860s tubman served instrumental spy union army famously joined colonel james montgomery 2nd south carolina infantry group ’ 1863 raid combahee river plantations tubman provided scouting nursing cooking aid.4 george washington carver agriculture scientist educator george washington carver born early- mid-1860s diamond missouri initially enslaved mother sister carver separated family kidnapped slave raid carver family retrieved captors eventually taught read write care plants abolishment slavery 1865. carver went attend various schools midwest accepted botany program iowa state agricultural school became first african american earn bachelor master science degree young black conservatives push back narrative black americans progressive carver ’ agricultural research inventions led advancements soil health conservation rotational peanut crops usda reports carver famously made variety peanut-based products herbal concoctions later became professor tuskegee institute alabama historically black college.5 ida b. wellsamerican journalist civil rights advocate ida b. wells born holly springs mississippi july 16 1862 five months weeks delivery emancipation proclamation wells moved tennessee became teacher adulthood wells began write political articles lawsuit chesapeake ohio railroad 1887 forcibly removed first-class train car paid decision ultimately overturned tennessee supreme court mississippi history reports.wells later moved chicago took leadership role naacp wells went write exposés school segregation lynching memphis forced move york city safety continued investigative reports disparities american education system segregation mistreatment african americans experienced road women ’ suffrage famous written works include southern horrors lynch law phases 1893 mob rule orleans 1900 wells later moved chicago took leadership role naacp ran illinois legislature death 1931.6. w. e. b. du boisamerican sociologist historian william edward burghardt du bois born feb. 23 1868 great barrington massachusetts du bois first black graduate searles high school 1884 later earned bachelor arts fisk university tennessee america ’ library reports earned second bachelor ’ degree master doctorate history harvard university schooling du bois traveled germany fellowship university berlin studied works famous social scientists including gustav von schmoller heinrich von treitschke.du bois became founding member national association advancement colored people naacp america ’ oldest largest civil rights organization du bois used education talents writer editor address race relations u.s. advance rights black americans published 16 books sociology history politics including black reconstruction america souls black folk talented tenth du bois became professor history sociology economics atlanta university historically black research college methodist roots became founding member national association advancement colored people naacp america ’ oldest largest civil rights organization.the naacp characterizes grassroots organization builds black political power end structural racism 7 thurgood marshall thurgood marshall great-grandson slave first black member united states supreme court getty images thurgood marshall first african american appointed u.s. supreme court born july 2 1908 baltimore formerly named thoroughgood marshall legally changed name age 6. marshall later became interested law high school student ordered read u.s. constitution punishment prank pulled united states courts reports moment inspired become lawyer realized african americans able enjoy liberties laid bill rights.thurgood marshall exploring lifemarshall attended lincoln university howard university school law worked naacp legal defense education fund around 1935 marshall found counterarguments segregation reviewed u.s. supreme court ruling plessy v. ferguson 1896 stated facilities could divided race separate equal marshall found doctrine flawed created discrepancies education children received led take win several landmark cases famous case changed american school system brown v. board education 1954 declared segregation public schools unconstitutional.click apppresident kennedy appointed marshall federal judge u.s. court appeals 1961. four years later marshall appointed solicitor general president johnson 1967 johnson appointed marshall supreme court — served justice 1991.8. rosa parks rosa parks civil rights activist born 1913 tuskegee alabama getty images civil rights leader rosa parks born feb. 4 1913 tuskegee alabama name rosa louise mccauley married husband raymond parks 1932 worked seamstress became member montgomery national association advancement colored people national parks service reports.at age 42 parks arrested refusing give seat front bus white passenger move back practice ’ uncommon time jim crow arrest inspired 17,000 african americans start montgomery bus boycott lasted 13 months hurt city bus service ’ revenue parks remained symbol resilience time boycott finally came end 1956 supreme court ruled segregated buses unconstitutional parks moved detroit year later working naacp rep. john conyers d-mich. fight homelessness even created job training institute.she earned congressional gold medal honor 1991.9. shirley chisholm shirley chisholm first african american woman serve united states congress born brooklyn york nov. 30 1924 name shirley anita st. hill youth chisholm partially raised grandparents barbados family settled brooklyn good u.s. house representatives reports chisholm earned bachelor degree sociology brooklyn college master elementary education columbia university worked teacher daycare center director educational consultant entering politics.chisholm elected york state legislature 1964 u.s. house representatives 1968 represented brooklyn ’ bedford-stuyvesant district seven terms chisholm made waves house appealed initial committee assignment agriculture find committee relevant district follow us facebook lifestyle newsshe reassigned veterans affairs committee moved education labor committee dedicated advancing equal education employment opportunities 1972 chisholm democrat became first african american run major political party nomination president.10 martin luther king jr. reverend dr. martin luther king jr. born 1929 atlanta georgia getty images civil rights leader reverend dr. martin luther king jr. born jan. 15 1929 atlanta post-college king dedicated life fighting racial inequality peaceful resistance unjust laws notably protested segregation public schools restaurants hotels nonviolent sit-ins america ’ library reports king delivered moving speeches challenged mistreatment african americans faced jim crow laws called equality king delivered famous speech dream steps lincoln memorial 1963 washington jobs freedom.click sign lifestyle newsletterking notable accomplishments civil rights movement 1954-1968 included montgomery bus boycott pleading peace u.s. marshals called disperse freedom riders segregation protesters riding interracial buses montgomery leading voting rights selma montgomery met violent resistance however showed world assaults african americans faced peaceful protests photos cortney moore associate lifestyle writer lifestyle team digital",lifestyle,," February 24, 2023 7:15am EST",positive
78,"How to send Valentines to kids in hospitals, nursing home residents and more",https://www.foxnews.com/lifestyle/send-valentines-children-hospitals-nursing-homes-shelters,"february 2 check clicking foxnews.com.valentine ’ day day think others day spread love people facing set challenges.throughout country pediatric hospitals nursing homes shelters even employers frontline workers currently accepting valentine ’ day cards holiday goodies.here organizations gift ideas might want consider extending kindness to.valentine day secret special occasion ahead lovers st. jude children ’ research hospitalvalentine ’ day celebrants send virtual cards st. jude children ’ research hospital free pediatric hospital ’ website virtual card creators pick assortment colorful designs feature artwork inspired real patients st. jude st jude recommends writing encouraging notes patients cards sent year round valentine ’ day ways people support hospital holiday include sending monetary donations hosting fundraising events spreading awareness social media according st. jude ’ website.st jude partnered amazonsmile online shop processes cash donations giftable items charities cost.valentine ’ day 'scratch-off card craft tiktok lets hide messages sweetheart radio ’ hearts kids initiativenon-commercial radio station wlfj-fm radio accepting handmade valentine ’ day cards ’ distributed children ’ hospitals throughout north carolina station delivering cheer packets made cards fun goodies children ’ wards following seven hospitals north carolina children ’ hospital chapel hill wake med raleigh duke children durham vidant/maynard children ’ hospital greenville cape fear valley medical center fayetteville betsy johnson hospital dunn nash general rocky mount.his radio screen cheer packets cards goodies must received later wednesday feb. 8 according radio station website.valentine day know origins holiday valentine ’ day cards mailed dropped person address below.his radio -- hearts kids7610 falls neuse rd suite 155raleigh n.c. 27615the local radio station recommends card submitters refrain using glitter googly eyes making references illness religion providing candy toys instead radio suggests making uplifting gender-neutral holiday cards feature standard valentine ’ day greetings cards written spanish encouraged.one world oldest valentine day cards 1818 rediscovered 20 years cute little girl celebrating valentine day parents family holding heart shape decorations home interior istock wish lifetime aarp ’ cupid crewspreading valentine ’ day cheer seniors easy task aarp ’ wish lifetime organization volunteer-driven cupid crew campaign collects valentine ’ day cards nationally delivers heartfelt notes seniors socially isolated.pre-made cupid crew valentine ’ day cards downloaded wish lifetime website printed holiday celebrants personalize drop mail cards local senior communities someone know personally since pandemic ’ start many older americans become isolated missing chances connect communities passions life wish lifetime website states cupid crew help feel connected loved love action projectthe love action project already kicked annual valentine ’ day card drive aims create deliver 5,000 cards nursing home residents north carolina organization matches volunteers nursing homes cards sent directly facilities.according love action project sending valentine day cards seniors nursing homes fosters human connection curbs loneliness aids physical mental health volunteers interested participating year ’ card drive email love action project info iamlovenaction.org.click appopen door missionopen door mission nebraska-based shelter offers temporary housing food people need accepting handmade valentine ’ day cards decorations ’ distributed around holiday crafts dropped organization ’ administration building address below.open door mission2828 n 23rd st eastomaha neb 68110valentine ’ day cards include holiday candies distributed open door mission residents according nonprofit donated valentine ’ day decorations displayed open door mission ’ hearts hope banquet.follow us facebook lifestyle newssend cards meals frontline workersearly covid-19 pandemic citizens showed appreciation support frontline workers thank-you cards meals.those considerate offerings brought back valentine ’ day local hospitals police departments firehouses essential workers early covid-19 pandemic citizens showed appreciation support frontline workers thank cards meals considerate offerings brought back valentine ’ day istock whether ’ simple valentine ’ day card homemade baked good store-bought breakfast lunch dinner different ways spread holiday cheer make sure check organization ’ like extend valentine ’ day appreciation case specific gifting rules.click sign lifestyle newsletterif ’ like send valentine veteran active-duty service member read cortney moore associate lifestyle writer lifestyle team digital",lifestyle,," February 2, 2023 11:08am EST",positive
79,In memory of World War II veteran Lester Tanner: 'We are all Jewish',https://www.foxnews.com/lifestyle/memory-wwii-veteran-lester-tanner-we-all-jewish,"watch live friends natl wwii memorial pays tribute greatest generation ceremony dc ceremony honors millions men women served us armed forces wwii.a simple flagged-draped coffin rested altar sunday jewish funeral chapel manhattan upper west side could thousands funerals world war ii veteran honor guard lone soldier solemnly walks chapel center aisle stands attention head casket — salutes day history dec. 7 1941 pearl harbor attack kills 2,403 americans launches us world war iia solo trumpet plays taps another soldier makes trek stands foot casket fold flag careful precision time many world war ii veterans leaving us writes lauren green important let stories die tells story wwii veteran lester tanner whose funeral held last week manhattan istock soldier presses triangular folded flag chest faces family hands flag salutes.then says behalf president united states — thank service country ‘ greatest generation ’ leaving us world war ii vets dying increased rate department veterans affairs estimates 2036 hundred remaining greatest generation time many leaving us important let stories die them.lester tanner died last week 99 years old lester tanner world war ii veteran passed away recently age 99. funeral everyone talked incredible life writes lauren green courtesy jewish foundation righteous service sunday everyone talked incredible life ordinary really — full blessings make life joy.a harvard law degree thriving business wife children stepchildren six grandchildren seven great-grandchildren way lives touching lives bringing lives world possible nearly 80 years ago man brave enough stand gap say jewish tanner story entwined saga roddie edmonds tanner story entwined saga roddie edmonds.edmonds master sergeant 106th infantry division 422nd infantry regiment united states army world war ii undated photo shows world war ii united states army master sgt roddie edmonds — stood lester tanner jewish soldiers pow camp world war ii courtesy yad vashem via ap highest ranking officer nazi stalag ix prisoner war camp captured nearly 1,300 american soldiers battle bulge december 1944. soldiers barefoot marched brutally miles snow cold tanner many others suffered severed frostbite made feet scaly even decades later.tanner explained world war ii man named roddie edmonds stood became defining moment life edmonds never told family experiences war son christopher baptist minister always curious yet father died 1985 age 65 never talking experiences pow camp.but 2008 article appeared york times lester tanner — 1980 sold townhouse former president richard nixon nixon rejected apartment building residents n't want living near lester tanner left chris edmonds learned father roddie edmonds saved tanner jewish soldiers war courtesy jewish foundation righteous tanner devoted democrat thought terrible reached nixons could buy place explaining democrat would gracious disgraced republican tanner explained world war ii man named roddie edmonds stood him.it became defining moment life — made committed same.roddie edmonds saved lives least 200 jewish soldiers inspired bravery men gave hope could survive camp return home article caught christopher edmonds attention learned father done.in january 1945 pow camp nazi commandant ordered master sergeant edmonds jewish soldiers fall next morning reagan library california host holocaust year ‘ emotional ’ says survivorit meant nazis would separate extermination hitler final solution edmonds told men night n't going dried roses seen fence site former auschwitz-birkenau camp commemorations honor victims wojtek radwanski / afp next morning nearly 1,300 american soldiers lined 19-year-old tanner stood edmonds right another young jewish soldier paul stern left commandant incensed approached edmonds yelled ca n't jewish edmonds answered jewish commandment cocked pistol put edmonds forehead threatening kill n't jewish soldiers fall christopher edmonds first met lester 2013. friendship inspired book well documentary edmonds refused commandant even kill know tried war crimes commandant relented put pistol back holster walked away.that day roddie edmonds saved lives least 200 jewish soldiers york woman whose relatives killed holocaust gets striped pajamas pulled shelveshe inspired bravery men gave hope could survive camp return home.christopher edmonds first met lester 2013. friendship inspired book well documentary greatest honor know lester christopher edmonds spoke lester funeral saying greatest honor know lester lester treasure quoted psalm 118 knowing unlikely scripture funeral told story lester life day lord made let us rejoice glad click sign lifestyle newsletterin 2015 roddie edmonds recognized righteous among nations yad vashem world holocaust remembrance center.the accolades tell great story click appbut lester j. tanner family friends precious lesson value life — fearlessness courage man — made lives possible lauren green currently serves channel fnc chief religion correspondent based york bureau joined fnc 1996. book lighthouse faith god living reality world immersed fog host digital spirited debate",lifestyle,," January 17, 2023 4:40pm EST",positive
80,Why does so much of Gen-Z hate America? Here's why we can't give up on them,https://www.foxnews.com/opinion/why-gen-z-hate-america-why-cant-give-up-them,piers morgan sounds 'woke indoctrination 'not american problem piers morgan host 'piers morgan uncensored discusses joe rogan latest rant slamming 'woke left indoctrinating young americans sounds tensions within royal family following prince harry explosive claims.newyou listen articles ’ wrong today ’ youth previous generations rebellious youth always topic consternation old folks ’ listen drive fast talk loud wear funny clothes ’ respect teachers.but something changed last years older generations far worried would past.a recent morning consult poll found 16 percent gen z ’ ers proud live united states millennials somewhat saner 36 percent.these numbers set alarm bells last ten years sharp decline national pride accident ’ deliberate attempt left destroy american patriotism replace ideology 2013 85 percent americans extremely proud american today number 63 percent ’ 2016 number ever dipped 80 percent sometimes high 80s 90s ’ collapse.gen z wo n't talk phone — ‘ phone lady ’ mission videothis accident indoctrination happening schools resulted kind opinion among young.the numbers show complete lack knowledge rest world kids learning school u.s. freest country history humanity country set example democracy freedom beacon hope people world meh great.the kind privilege takes hold opinion mind-boggling means person taught believe immense advantages sheer luck american important know struggle people across world still go free desperately people want americans haters taught take granted freedom liberty birthright.in last years left successfully taken curriculums public schools across country push idea america great force 1619 project onto curriculums remove discussion founding fathers american history general education geared idea america terrible place videoaside wrong ’ deeply myopic people push idea think worldly worldliness involves knowing something countries shortsighted people born third base thinking ’ hit triple.click opinion newsletterdeep americans patriotic people yes even young people ’ gotten admitting permitted millennials generation z first generations raised cancel culture forced conformity thought break pack teachers say america ’ great greatest simply allowed wrongthink lead bad grades harassment peers take bravery young people overcome happening take standing ideas know true told long not.click appmore take older generations tsk-tsking kinds numbers educate young people homes lives miracle american experiment miracle needs maintaining needs continued effort ensure success cancel culture push leftist conformity destroyed eventually older generations fight ’ give youth make happen.click read karol markowicz karol markowicz columnist york post written time usa today observer heat street federalist daily beast elsewhere follow twitter karol,opinion,," January 17, 2023 4:00am EST",positive
