,Title,Link,Corpus,category,author,timeanddate,sentiment
106,Don’t use TikTok? The China-owned social network may still have your data.,https://www.foxnews.com/tech/dont-use-tiktok-china-owned-social-network-still-your-data,robots replacing security guards give gun kurt cyberguy knutsson explains whether robot security guards better worse society.a report cybersecurity company feroot security reveals tiktok track even 've never used app deeply concerns comes biden administration still debates whether popular social media app banned united states know far.click kurt ’ cyberguy newsletter quick tips tech reviews security alerts easy how-to ’ make smarterhow tiktok track 've never used app according feroot tiktok trackers called pixels pixels pop website tiktok embedded trackers pick tons information including usernames passwords credit card banking information details personal health even site requires extra logins authentications tiktok pixels collecting information transferring around globe.is facebook listening person using tiktok unaware tracks cyberguy.com tiktok owned chinese company bytedance company required turn data information collect chinese government moment ’ notice therefore data shared chinese government used spy spread misinformation american people.more ask kurt tiktok videos safe view outside app biden administration biden administration trying come agreement tiktok data security last years warned bytedance may sell app face total ban app throughout united states app already banned united kingdom among government-issued devices unless agreement made fast would n't surprising start seeing kind bans happening here.tips help tell online store real scam biden administration attempted make agreement bytedance sell face total ban cyberguy.com limit information tiktok access still want use tiktok careful information 're putting ways limit much information tiktok access you.turn sharing contacts facebook friends open tiktok appclick profile icon bottom right cornerclick 3 horizontal lines right corner tap settings privacyclick privacyclick sync contacts facebook friends toggle optionsdisable personalized ad sharing open tiktok appclick profile icon bottom right cornerclick 3 horizontal lines right corner tap settings privacyscroll click adstoggle using off-tiktok activity ad targeting reveals data breach affecting 9 million wireless accounts videomake account private.here open tiktok appclick profile icon bottom right cornerclick 3 horizontal lines right corner tap settings privacyclick privacytoggle private accountdownload data find tiktok collected open tiktok appclick profile icon bottom right cornerclick 3 horizontal lines right corner tap settings privacyclick accountselect download dataclick request data may take days process data reportwill continue use tiktok learning information let us know thoughts.click appfor tips subscribe free cyberguy report newsletter clicking free newsletter link website.copyright 2023 cyberguy.com rights reserved kurt cyberguy knutsson award-winning tech journalist deep love technology gear gadgets make life better contributions business beginning mornings friends got tech question kurt ’ cyberguy newsletter share voice story idea comment cyberguy.com,tech,," March 19, 2023 9:27am EDT",positive
107,Robots are replacing security guards. Should we give them guns?,https://www.foxnews.com/tech/robots-replacing-security-guards-give-guns,"robots replacing security guards give gun kurt cyberguy knutsson explains whether robot security guards better worse society.ai technology seems finding way every industry fast-food chains delivering packages automatic self-driving vehicles companies incorporating ai security guards keep businesses safe however 'm sure bots reliable let see robot security experiments turning reality.click kurt ’ cyberguy newsletter quick tips tech reviews security alerts easy how-to ’ make smarterhow ai security guards used robot guards used mainly office buildings various jobs leading charge populate office buildings cobalt robotics company specializes artificial intelligence robotic automation handle mundane important tasks ... never miss call even phone another room cobalt robotics leading companies creating robots guard patrol office buildings cyberguy.com/cobalt robotics tasks include things like patrolling office buildings broken fire alarms suspicious activity checking visitors main reason lot office buildings beginning use robots human beings saves ton money roughly 79,000 per year according report forrester research although work longer hours multiple tasks n't know would trust machine kind weaponry case malfunction let go pros cons using technology.more find ’ spying youwhat pros ai security guards big pro ai security guards might able detect danger security camera even human tired distracted would safer confront intruders risk life human security guard.another perk two-way communication system robots designed employees report issue directly bot 'd rather deal human ca n't find request human presence robot alert proper department.is facebook listening cobalt robotics set many features bots makes human communication much easier cyberguy.com/cobalt security specifically cobalt robotics security guard designed fabric pass high-end furniture intruder may even realize first glance security guard watching might clever design companies may take note keep security guard disguise.how drones revolutionizing delivery taking skieswhat cons ai security guards con human security guards may lose jobs however argued human beings always designated jobs fixing ai technology malfunctions coming handle issue employee want go robot.how compare vacation rental home prices many worry robots replace human security guards tech advances cyberguy.com/cobalt security con concerned technology malfunctioning 've seen ai technology malfunction time whether something like chatgpt saying wrong thing self-service machine mcdonald service plus n't much detail robots actually prevent crime security guards meant keep people designated building safe 'm little hesitant put trust ai bots companies certain 're safest option wo n't malfunction times need.more u.s. military jet fglows ai 17 hours – worried arming robots gunsthe san francisco police department proposed policy would allow robots armed could even use deadly force situation extreme enough public police imminent danger policy denied police department interested putting back table.so poses question trust robots carry weapons instead paying human job let us know thoughts.click appfor tips subscribe free cyberguy report newsletter clicking free newsletter link website.copyright 2023 cyberguy.com rights reserved kurt cyberguy knutsson award-winning tech journalist deep love technology gear gadgets make life better contributions business beginning mornings friends got tech question kurt ’ cyberguy newsletter share voice story idea comment cyberguy.com",tech,," March 19, 2023 9:04am EDT",positive
108,Never miss a call again even when your phone's in another room,https://www.foxnews.com/tech/never-miss-call-again-phone-another-room,kurt 'the cyberguy knutsson explains never miss call smartphone iphone android connect device third-party bluetooth speakers avoid missing calls notifications.hey howard p. 've got help need thanks sending smart question use cell phone home gadget ring loud someone calls cell phone hear ring cell phone loud enough another room.- howard click see kurt ’ best bluetooth speakers sign free cyberguy newsletter quick tips tech reviews security alerts easy how-to ’ quick short answer howard question yes use bluetooth speaker smart speaker speakerphone cell phone smart speakers amazon echo google home built-in speakers connected phone via bluetooth let explain set bluetooth speaker cyberguy.com stalked devices take steps nowhow connect phone bluetooth speaker iphone connect device third-party bluetooth speaker make sure bluetooth speaker turned stand near speaker iphone hand open settings app iphone click bluetooth make sure toggled make bluetooth speaker discoverable putting pairing mode phone specifically listed instructions come whatever speaker have.once speaker discoverable name appear iphone bluetooth screen tap name speaker connect iphonenow commonly used speaker iphones bluetooth amazon echo uses alexa virtual assistant receive calls.how set alexa app iphone connect echo speaker set alexa iphone open settings app iphoneselect bluetooth toggle ondownload alexa app app store iphoneopen app log amazon email password select name press agree continuethe next step ask set voice id go back later press skip right-hand corner press yes skip confirmclick set features next asked set contacts press continue follow onscreen prompts alexa device access contacts make receive calls.iphone owners outraged forced clean energy usage settinghow pair iphone amazon echo speaker downloaded alexa app begin pairing iphone amazon echo speaker following instructions make sure echo speaker turned within range iphone want pair itpress hold action button echo speaker five seconds light ring speaker begin spin blue indicating pairing modelaunch alexa app select echo speaker devices section choose connect device option start pairing iphonenow select pair device option make alexa search deviceswhile assistant searching bluetooth devices go bluetooth settings iphone select echo speaker connectonce connected 'll see iphone list paired devices alexa app successfully connected iphone echo speakernote specific steps may vary slightly depending model echo speaker pair android bluetooth speaker android user connect device third-party bluetooth speaker.this iphone charging feature facing scrutiny reportmake sure bluetooth speaker turned stand near speaker android handswipe screentouch hold bluetooth tap pair deviceif n't find pair device check available devices tap > refreshcheck instructions bluetooth speaker find make discoverabletap name bluetooth device want pair devicefollow on-screen instructionswhen call comes speaker ring loudly allowing hear even another room.what ways alerted cellphone ringing incoming call displayed iphone cyberguy.com record screen phone tablet computerone tool use sound-amplifying app apps available ios android devices meant let amplify sound ringtone hear room best ones found iphones androids siren ringtones iphone 4.5 stars time publishing siren ringtones cyberguy.com app highly rated iphones 4.5-star rating time publishing contains siren sound effects ringtones grouped easy-to-use application allows customize ringtone text tone voicemail alerts email alerts calendar alerts reminders crystal clear loud siren ringtones super loud ringtones android 4.4 stars time publishing super loud ringtones cyberguy.com apple software update released fix important security issuethis app highly rated android phones 4.4-star rating time publishing easy use free ringtones 'll never worry missing another call personalize setting ringtone calls setting specific ringtones certain person alarm notification enable visual settings especially helpful level hearing loss many iphone android models settings use alert cellphone ringing screen camera light within line vision wo n't worry missing call set visual settings iphone go settingstap accessibilityunder hearing tap audio/visualunder visual tap led alertstoggle led alertshere set visual settings android go settingstap accessibilitytap advanced settings select notifications toggle camera screen options depending preferclick appwhat ways make sure always hear phone rings comment tips subscribe free cyberguy report newsletter clicking free newsletter link website copyright 2023 cyberguy.com rights reserved kurt cyberguy knutsson award-winning tech journalist deep love technology gear gadgets make life better contributions business beginning mornings friends got tech question kurt ’ cyberguy newsletter share voice story idea comment cyberguy.com,tech,," March 18, 2023 1:11pm EDT",positive
109,"Gloria Dea, first Las Vegas magician, dead at 100",https://www.foxnews.com/entertainment/gloria-dea-first-las-vegas-magician-dead-100,entertainment week entertainment celebrity gloria dea first magician perform las vegas strip 1940s died 100.dea born gloria metzner oakland california died saturday hospice care residence las vegas director clinical services valley hospice confirmed associated press.not career sin city dea performed silver screen starring roles alongside buster crabbe king congo memorial planned honor later date.lance reddick wife stephanie speaks first time death ‘ taken us far soon ’ gloria dea las vegas first magician died saturday 100 k.m cannon dea 19 performed el rancho vegas may 14 1941.the iconic hotel first strip drew legendary performers stars alike including eartha kitt jon sondra steele abbott costello.paul newman joanne woodward ‘ complicated ’ marriage daughter says ‘ vibe tension ’ paul newman joanne woodward celebrated wedding reception el rancho dea show roundup room first recorded appearance magician las vegas review-journal reported strip really days dea told newspaper august turned 100 last frontier el rancho vegas started building flamingo gloria dea starred king congo buster crabbe getty images paul newman joanne woodward kiss wedding reception eartha kitt performed el rancho las vegas getty images added danced rumba difficult keep setting magic stuff gloria appeared several movies 1940s ’ 50s including plan 9 outerspace mexicana girl likely around world 80 days click sign entertainment newsletter saturday matinees kids ‘ plan 9 outer space ’ worst movie time… fun making though dea left california las vegas 1980. career resurgence later life though help fellow magician david copperfield gloria amazing charming funny engaging copperfield told newspaper vegas young magician started honor know gloria performed roundup room staple las vegas '40s k.m cannon dea reportedly child immediate family husband sam anzalone former california car sales executive died january 2022.click appshe scheduled inducted unlv college fine arts hall fame tuesday plans still go forward.dea inducted copperfield presentation full program.the associated press contributed report tracy wright entertainment writer digital send story tips tracy.wright fox.com,entertainment,," March 19, 2023 11:49pm EDT",positive
110,Andrew Lloyd Webber's son 'hospitalized' and 'critically ill' fighting gastric cancer,https://www.foxnews.com/entertainment/andrew-lloyd-webber-son-hospitalized-critically-ill-fighting-gastric-cancer,entertainment week entertainment celebrity renowned composer andrew lloyd webber announced son nicholas critically ill fighting gastric cancer.the joseph amazing technicolor dreamcoat musician revealed nick hospitalized due ongoing medical issues statement shared webber representatives digital absolutely devastated say eldest son nick critically ill webber friends family know fighting gastric cancer last 18 months nick hospitalised ‘ cats ’ composer andrew lloyd webber says movie ‘ off-the-scale wrong ’ led buy dog andrew lloyd webber says son nicholas battling gastric cancer getty images nick form disease disclosed gastric cancer commonly known stomach cancer andrew lloyd webber offers 1.3 million grant children therefore able attend recent previews 'bad cinderella things stand able cheer wonderful cast crew orchestra opening night thursday webber said.his latest broadway production reimagining cinderella ran london west end 2021-2022. andrew lloyd webber attended joseph amazing technicolor dreamcoat opening london wife madeleine son nicholas 2007 nick harvey press event show scheduled coincide famed composer 75th birthday wednesday 22 praying nick turn corner webber added bravely fighting indomitable humour moment place family click sign entertainment newsletternicholas picked family music gene composer 2021 uk film last bus earned accolades work 2017 bbc drama love lies records grammy nomination co-producer best musical theater album father 2021 cinderella andrew lloyd webber brought nicholas daughter imogen ex-wife sarah brightman opening prospects love 1990 broadhurst theater york ron galella andrew married nicholas mother sarah hugill 12 years divorced 1983. former couple daughter imogen lloyd webber.the egot kennedy center honoree closing phantom opera broadway 2023. fixture broadway since 1988 production initially set feb. 18 day previews begin bad cinderella due high demand tickets show received eight-week extension closing date scheduled april 16.his astonishing run great white way signifies lloyd webber musical performed broadway every single playing night since september 1979.click app tracy wright entertainment writer digital send story tips tracy.wright fox.com,entertainment,," March 19, 2023 6:14pm EDT",positive
111,"'Good Burger' sequel announced by Kenan Thompson, Kel Mitchell",https://www.foxnews.com/entertainment/good-burger-sequel-announced-kenan-thompson-kel-mitchell,film producer david tice talks longtime friendship dennis quaid david tice director producer ‘ grid power ’ told digital casting dennis quaid film ‘ great creative movement ’ kenan thompson kel mitchell confirmed friday star sequel beloved 90 movie good burger thompson mitchell appeared nbc tonight show starring jimmy fallon discuss film begin production may blessing man thompson fallon unbelievable 1997 movie good burger based comedy sketch nickelodeon starred thompson mitchell dexter ed.kelsey grammer overcome emotion film ‘ best thing ever done actor kenan thompson actor kel mitchell interview jimmy fallon friday 17 2023 dexter reed thompson luck another inventions fails ed mitchell welcomes dex back good burger open arms gives old job back crew working good burger dex devises plan back feet unfortunately puts fate good burger risk sequel official logline says.the movie set premiere streaming service paramount+ later year ’ believe ’ little 25 years since great customer service born good burger thompson statement part something many generations people come love made proud back began working sequel surreal ‘ jesus revolution ’ performs miracles box office receives rave reviews audience kenan thompson kel mitchell smiling scene film 'good burger 1997 paramount/getty images love performing brother kel ’ wait show fans characters since last saw statement added.mitchell statement shared thompson enthusiasm calling blessing revive beloved characters kel mitchell kenan thompson publicity portrait film 'good burger 1997 paramount/getty images click app ed timeless characters brought much joy laughter fans ’ beautiful blessing still years ’ super awesome come back continue stories dex ed good burger people grew watching kids mitchell,entertainment,," March 19, 2023 5:11pm EDT",positive
112,Emma Heming celebrates Bruce Willis' birthday with emotional tribute following his dementia diagnosis,https://www.foxnews.com/entertainment/emma-heming-celebrates-bruce-willis-birthday-emotional-tribute-following-dementia-diagnosis,"bruce willis diagnosed frontotemporal dementia behavioral neurologist dr. bruce miller discusses actor bruce willis diagnosis explains accompanying symptoms.emma heming willis shared emotional update fans sunday celebrated bruce willis birthday.the die hard actor received frontotemporal dementia diagnosis last month previously battling aphasia.heming told instagram followers deals sadness grief every day especially overcome emotions bruce 68th birthday today husband birthday emma started morning crying see swollen eyes snotty nose bruce willis diagnosed frontotemporal dementia following aphasia battle family says bruce willis wife emma heming shared emotional tribute bruce 68th birthday frederick m. brown think important see sides always message people always tell 'oh 're strong n't know 'm given choice wish im raising kids bruce willis dementia battle iconic star journey action hero family manbruce emma children together daughters mabel evelyn.he three daughters ex-wife demi moore rumer scout tallulah sometimes lives put big girl panties im emma times sadness every day grief every day … 'm really feeling today birthday view post instagram post shared emma heming willis emmahemingwillis worked reel 'm posting husband birthday n't know videos like knife heart bruce willis wife emma adding ‘ dementia care toolbox ’ amid actor diagnosisshe added much know much love husband – n't cry emma – means much thank willis family announced february condition progressed frontotemporal dementia ftd bruce celebrated holidays ex demi moore wife emma addition children demi moore instagram view post instagram post shared demi moore demimoore ftd result damage neurons frontal temporal lobes brain according national institute aging many possible symptoms result including unusual behaviors emotional problems trouble communicating difficulty work difficulty walking click sign entertainment newsletterthe family shared cruel disease statement posted association frontotemporal degeneration aftd website people 60 ftd common form dementia getting diagnosis take years ftd likely much prevalent know today treatments disease reality hope change years ahead release bruce willis demi moore divorced 20 years ago remained l-r rumer demi bruce scout emma tallulah attend demi 'inside book party september 2019 stefanie keenan bruce emma married since 2009 daughters theo wargo bruce always believed using voice world help others raise awareness important issues publicly privately know hearts — could today — would want respond bringing global attention connectedness dealing debilitating disease impacts many individuals families 2022 family announced willis would retiring acting receiving aphasia diagnosis disorder affects communication including ability understand verbal cues written words.according national aphasia association disorder affects 2 million americans nearly 180,000 diagnosed disorder annually.willis set become grandfather soon december oldest daughter rumer announced pregnant first child.click app tracy wright entertainment writer digital send story tips tracy.wright fox.com",entertainment,," March 19, 2023 4:25pm EDT",positive
113,Top bond ETFs for 2023,https://www.foxbusiness.com/markets/top-bond-etfs-for-2023,"blackrock salim ramji investors turn etfs volatile times blackrock global head etfs index investments salim ramji discusses popularity etfs 2022 became second best year investment vehicle 'the claman countdown ’ allocating investments 2023 may worthwhile consider bond etfs bond etfs hold bonds within exchange-traded fund wrapper trades like stock says roxanna islam associate director research vettifi compared direct investment bonds bond etfs liquid transparent provide frequent income addition islam says many investors comfortable equity investments fixed-income investments due simplicity familiarity putting bonds etf wrapper allows fixed income investments accessible investors reluctant buy bonds directly islam tells business 401 k might etfswhy bond etfs wise investment choice bryan armour morningstar director passive strategies research north america says bond funds – regardless mutual fund etf – great way diversify bond exposure reduce risks inherent issuer set issuers investors lean professional management funds regardless whether active passive armour tells business alternative would investors running strategy purchasing bonds reinvesting time came due approach carries little benefit investor given extremely low fees passive broadly diversified bond funds etfs hedge inflation armour morningstar provided information regarding bond etfsvanguard total bond market index fund – armour says etf broad scope holds 10,000 investment-grade bonds low fee 0.03 help fund outperform peers long run.ticker security last change change bnd vanguard bd index fund inc total bond market 73.72 +0.53 +0.72 roughly half portfolio allocated government bonds corporate bonds securitized debt filling half says fund puts lid credit risk exposure still gets yield boost compared similar duration treasury etf give morningstar analyst rating gold photo provided york stock exchange trader ryan falvey works floor tuesday may 3 2022 courtney crow/new york stock exchange via ap courtney crow/new york stock exchange via ap / ap newsroom fidelity total bond etf– armour says etf good reminder etfs n't synonymous passive investing actively managed etf leverages deep experience solid resources thoughtful execution low cost 0.36 earn stripes says.ticker security last change change fbnd fidelity merrimack street trust total bd etf 45.90 +0.24 +0.53 sector allocation change depending sees best opportunities portfolio generally holds 35-40 government corporate bonds 20 securitized debt n't shy away high-yield issuers make 14 holdings provides yield boost similar investment-grade-only etfs give morningstar analyst rating gold armour says.vanguard total international bond index fund – according armour bndx takes abroad strategy bnd resulting similarly cheap diversified portfolio.ticker security last change change bndx vanguard charlotte funds total international bond 49.08 +0.34 +0.70 includes investment-grade bonds issued currencies u.s. dollar uses forward contracts hedge currency risk explains armour currency hedging gives cleaner exposure local bond returns reduces impact currency fluctuations sensible low-cost approach earned morningstar analyst rating silver",markets,,"Published March 19, 2023 8:11pm EDT
        ",positive
