,Title,Link,Corpus,category,author,timeanddate,sentiment
0,"US company outraged after Mexican military, police seized Caribbean facility",https://www.foxnews.com/politics/american-company-outraged-mexican-military-police-seized-caribbean-facility-this-is-insane,watch security footage appears show mexican military seizing operations american company vulcan materials quintana roo mexico security footage provided vulcan materials appears show mexican military police seizing american company operations quintana roo mexico.the seizure american company quarry facility mexico mexican military local state police sparked outrage among former current government officials well appeals biden administration mexico u.s. ambassador intervene.according vulcan materials birmingham alabama-based company largest producer construction aggregates u.s. members mexican navy local state police along federal investigators entered quarry south playa del carmen mexico quintana roo state early morning hours 14. forced company allow cemex mexican-owned materials company unload shipment cement ship port.vulcan previously leased land provided offloading handling services cemex site agreement expired last december talks renegotiated contract broke company cemex completed unloading forced shipment friday however military police remained control property given indication plan leave company writing request government immediately order forces officials leave private property vulcan chairman ceo j. thomas hill wrote letter mexican ambassador esteban moctezuma barragán thursday days following initial seizure.american citizen ‘ kidnapped residence ’ mexico fbi says government participation gross violation property rights yet another example government arbitrary illegal treatment vulcan investments mexico occupation must cease immediately added.vulcan tension mexico months mexican president andrés manuel lópez obrador forced shutdown quarry operations may 2022. lopez obrador accused company trying extract minerals mexico without required permits ship u.s.the government suspended vulcan customs permits may 13 days shutting quarry company says put strain ability provide stone construction aggregates construct roads bridges infrastructure u.s. prompted lawmakers request biden administration take swift action.the quarry remained closed amid legal proceedings mexican courts although biden administration officials working mexican government find solution company said.dea aware mexican pharmacies selling fentanyl-laced pills three years reportsen katie britt r-ala. ranking member senate homeland security appropriations subcommittee told digital discussed tensions vulcan mexican government mexico secretary foreign affairs marcelo ebrard official trip mexico city last month told mexican government needed focus going cartels endangering mexican citizens millions tourists visit country year katie britt r-ala. tom williams / cq-roll call inc. via getty images / file forcible seizure private property unlawful unacceptable shameful mexican presidential administration would rather confiscate american assets fentanyl killing hundreds americans per day president biden must raise directly president lópez obrador assure american people tolerated ramifications illicit seizure extend united states significantly hamstringing important american infrastructure energy construction projects currently rely vulcan ’ operations mexico materials office continue monitor situation ensure swept rug added.former director national intelligence john ratcliffe served trump administration reacted apparent seizure twitter calling biden administration defend vulcan.mexico medical tourism booms americans risk lives surgeries ‘ worst choice ever made ’ getting pretty used biden administration letting china russia kick sand faces covid fentanyl deaths spy balloons taking u.s. mq-9 reaper —but mexico wrote twitter sunday biden administration needs engage immediately defend u.s. company protect u.s. interests deep water port yucatán peninsula significant geopolitical economic implications added photo illustration vulcan materials company logo seen displayed smartphone rafael henrique / sopa images / lightrocket via getty images / file former trump administration official cliff sims reacted apparent seizure expressing shock mexican military move mexican military seized u.s. company ’ vulcan materials marine terminal mexico insane wrote twitter including security footage military entering facility.security footage vulcan mexican quarry 14 obtained digital appears show members mexican military quintana roo state police arriving main gate quarry forcing guard allow inside armed group accompanied appeared cemex personnel.according vulcan military told on-site personnel order bring cemex vessel port unload contents company however military present possess court order allowing legally enter property.ways means chair condemns mexico threat campaign republicans ‘ unacceptable ’ company suggested move could lopez obrador first step taking control port guise national security intention using import materials cuba go toward railway system called mayan train currently constructed region.vulcan speculates cemex seek occupy property support military police unknown period distribute unloaded materials customers screenshot security provided vulcan materials shows mexican police military entering company facility quintana roo mexico 14 2023 vulcan materials response seizure vulcan filed federal civil criminal protections lodged general federal complaint mexican military quintana roo state police local prosecution authorities cemex acting without warrant breaching previous federal court injunction concerning land denied access files supposedly supported actions taken vulcan.vulcan provided copy subsequent 16 court order judge angélica del carmen ortuño suárez second district judge state quintana roo ordered military cease actions says force still left premises click app digital reached u.s. state department comment receive immediate response ambassador moctezuma office offices cemex immediately respond requests comment brandon gillespie associate editor follow twitter brandon_cg,politics,," March 19, 2023 9:59pm EDT",negative
1,Dictator Kim Jong Un calls on North Korean military to be prepared to launch a nuclear attack,https://www.foxnews.com/world/north-koreas-kim-jong-un-calls-nuclear-attack-preparedness-us-south-korea,"north korean defectors honor otto warmbier kim jong un ’ victims ‘ north korean freedom foundation ’ chair suzanne scholte joins ‘ live ’ discuss protests front north korea ’ mission united nations.north korean leader kim jong un called country ready launch nuclear attack deter war accused u.s. south korea carrying military drills american nuclear assets according state media kim remarks carried state media kcna came hermit kingdom launched short-range ballistic missile toward sea sunday missile flew across country landed sea east coast according south korean japanese assessments – reported missile traveled distance 500 miles file north korean leader kim jong un attends 7th enlarged plenary meeting 8th central committee workers party korea wpk pyongyang north korea 1 2023 photo released north korea korean central agency kcna kcna via reuters kim oversaw test exercises improved military actual war capability highlighted need ensure readiness posture immediate overwhelming nuclear counterattack drills kcna quoted kim saying north urgently needed bolster nuclear war deterrence exponentially enemies getting ever pronounced moves aggression country us partners stage warfare drills japan south korea strengthen alliance china north korea nuclear force dprk strongly deter control manage enemy reckless moves provocations high war readiness carry important mission without hesitation case unwanted situation kim quoted saying kcna photos showed kim attending test young daughter flames roared soaring missile hit target file tv screen shows program reporting footage north korean leader kim jong un pyongyang seoul railway station seoul south korea dec. 27 2022 ap photo/lee jin-man file u.s. south korea weeks carrying annual exercises including air sea drills involving u.s. b-1b strategic bombers country ’ respective navies marine corps set kick first large-scale ssangyong amphibious landing exercises five years monday two-week run april 3. north korea frequently condemned exercises likening dress rehearsal invasion click appin another dispatch kcna 1.4 million north koreans volunteered join re-enlist military fight south korean us troops – 800,000 enlistees reported weekend ’ anders hagstrom contributed report bradford betz digital breaking reporter covering crime political issues much",world,," March 19, 2023 8:50pm EDT",positive
2,Terrifying clip of meteorologist collapsing on live television goes viral,https://www.foxnews.com/media/terrifying-clip-la-meteorologist-collapsing-live-tv-goes-viral,nfl ‘ uncharted waters ’ following damar hamlin collapse boomer esiason former nfl quarterback boomer esiason reacts positive buffalo bills safety damar hamlin discusses ’ next nfl heading playoffs.a los angeles cbs meteorologist hospitalized fainting air saturday terrifying moment gone viral social media.weatherwoman alissa carlson schwartz stunned viewers collapsed live tv kcal co-anchors cut weather report rain l.a. week 7:00 a.m. hour schwartz appeared visibly pale leaned forward eyes could seen rolling back head seemingly tried catch falling head slumped desk lost consciousness fell ground.fox meteorologist adam klotz attacked nyc subway stopping teens assaulting older man meteorologist alissa carlson schwartz eyes rolled back head losing consciousness screenshot kcal los angeles schwartz co-anchors nichelle medina rachel kim dd appear immediately aware transpired perhaps initially thinking schwartz reacting upcoming weather forecast soon realized something wrong told viewers ’ going take quick break right morning show return live segment tmz reported.millennials racking chronic health conditions compared generations study alissa carlson schwartz fainted televised weather report screenshot kcal los angeles cbs los angeles vice president director mike dello stritto told outlet schwartz co-workers rushed call 911 treated local hospital offer details caused collapse.schwartz posted facebook sunday thanks kind wishes recover head injury hospital ok. lots sleeping even pizza – ty unclear collapse caused head injury whether sustained head injury result fall appreciate prayers recover wrote come… tmz reported schwartz experienced another medical incident 2014 working another network reportedly vomited live set weather report later diagnosed leaky heart valve.click appin facebook post sunday schwartz latest collapse unrelated heart thankfully heart time wrote adding lots sleeping takes time recover yael halon reporter digital story tips sent yael.halon fox.com,media,," March 19, 2023 6:16pm EDT",positive
3,Blue state's attorney general hosts city's first 'Drag Story Hour Read-a-Thon' for kids,https://www.foxnews.com/media/new-york-ag-letitia-james-hosts-drag-story-hour-children-celebration-love-joy-family-fun,objective parent knows children n't belong drag show jimmy failla 'the big sunday show panelists discuss york city government hosting drag queen story hour children.new york city ’ first drag story hour read-a-thon officially kicked sunday hosted york attorney general letitia james.the drag story hour james attended several elected officials lgbtq advocacy groups according press release james office nearly 200 guests including families enjoyed four back-to-back story hours lgbt community center.james celebrated occasion twitter featuring pictures alongside elected officials york families drag queens time drag story hour 're lgbtcenternyc amazing drag story hour nyc storytellers york families elected officials community leaders kick drag story hour read-a-thon james tweeted york attorney general letitia james attends campaign rally community leaders jackson heights neighborhood queens borough york city nov. 1 2022 ap photo/eduardo munoz alvarez file libs tiktok ’ nyc book event kids canceled receiving threats ‘ unsafe behavior ’ another tweet read raise hand 're excited drag story hour picture child raising hand event recent rise anti-lgbtq+ protests rhetoric policies left yorkers — included — devastated disappointed know better anyone choice love hate joy venom yorkers always choose love yorkers always choose joy james statement proud joined colleagues advocacy government today celebration love joy family fun drag story hour brings communities hate home york always fight ensure lgbtq+ siblings ’ rights upheld defended according press release event intended condemn hate combat rampant disinformation recent months seen rise homophobic protests fearmongering surrounding drag story hour disgraceful harassment vitriol directed lgbtq+ community advocates leaders image drag queen reading drag queen story hour hosted york attorney general letitia james sunday twitter james originally promoted event instagram flier reading drag story hour nyc york state attorney general letitia james families children invited join attorney general james drag storytellers city state elected leaders view post instagram post shared york ag letitia james newyorkstateag event largely condemned social media conservative influencer ashley st. clair commenting tax dollars hard work grooming kids outrage ny attorney general letitia james hosting ‘ drag story hour ’ children ‘ way ’ york city mayor eric adams quoted saying drag storytellers organizations support advancing love diversity personal expression literacy core city embraces stories ’ teach children love reading help understand people different time lgbtq+ communities increased attack across country must use stories educate goal children academically smart emotionally intelligent thank attorney general james hosting event clearly says york city place love want event followed florida gov ron desantis ’ office announcing revoke miami hotel ’ liquor license discovered hotel hosted lewd christmas-themed drag show involving children last december child raises hand york city drag story hour hosted attorney general letitia james twitter click appin contrast book event york city libsoftiktok account owner chaya raichik canceled friday threats unsafe behavior raichik event intended counter james drag story hour sunday lindsay kornick associate editor digital story tips sent lindsay.kornick fox.com twitter lmkornick,media,," March 19, 2023 7:58pm EDT",positive
4,Twitter users don’t let Biden get away with dubious claim about taxes,https://www.foxnews.com/politics/bidens-twitter-account-fact-checked-dubious-claim-billionaires-taxes,kilmeade biden admin perfects blame game host brian kilmeade discusses weak biden emboldens putin russia worsens ongoing border crisis saturday opening monologue.president joe biden twitter account posted questionable statistic saturday much tax american billionaires pay look think able billionaire earn pay fair share biden tweet read think ought pay minimum tax 25 ’ basic fairness tweet included graphic biden quote know average tax billionaires pay three percent billionaire paying lower tax somebody working schoolteacher firefighter unclear 3 figure came contradicts figures white house issued past.biden family received 1m hunter associate 2017 china wire house oversight president joe biden speaks university tampa feb. 9 2023 joe raedle / getty images february white house issued fact sheet called biden economic plan working calculated much tax u.s. could collect counted unrealized gains – potential profit unsold asset – income typical year billionaires pay average tax rate 8 fact sheet read factoring unrealized gains reason lower statistic using existing definition taxable income really rich people pay average federal income tax rate mid-20s brookings institution tax policy center senior fellow howard gleckman told politifact july want include unrealized gains denominator white house average rate would go way hunter biden subpoenaed bank america records opened 'new avenues investigation house oversight saysanother white house figure 2021 gave 8 figure rather 3 biden recently cited analysis omb cea economists estimates wealthiest 400 billionaire families america paid average 8.2 percent income – including income wealth goes largely untaxed – federal individual income taxes 2010 2018 ’ lower rate many ordinary americans pay 2021 post read.in response twitter ceo elon musk disputed biden tax claim president joe biden delivers speech infrastructure spending carpenters pittsburgh training center wednesday 31 2021 pittsburgh ap photo / evan vucci click app paid 53 taxes tesla stock options 40 federal 13 state must lifting average south african entrepreneur wrote paid income tax anyone ever history earth 2021 2022 would curious hear 'billionaires good avoiding taxes musk added another tweet asking twitter community notes feature fact-check statement,politics,," March 19, 2023 8:04pm EDT",positive
5,Blue city leader decries lack of police officers after voting to defund them,https://www.foxnews.com/politics/san-francisco-supervisor-hillary-ronen-begs-more-police-district-voting-defund-2020,san francisco politician begs policing voting defund 2020 san francisco district supervisor hillary ronen begged city officials increase police presence mission district three years voted defund police san francisco board supervisors san francisco district supervisor calling policing crime-ridden city – despite advocating defund police 2020.hillary ronen democrat represents district 9 san francisco board supervisors budget appropriations committee meeting wednesday made impassioned plea add officers mission district represents.ronen attacking san francisco police chief spending large amount overtime anti-retail theft program instead prioritizing police presence district 've begging department give mission deserves terms police presence year long ronen told time time time time officers send mission concerns escalate san francisco rising crime hurting business hillary ronen gabrielle lurie / san francisco chronicle via getty images / file hurts feel betrayed department feel betrayed mayor feel betrayed priorities city democratic politician added speech contradicts stance policing 2020. george floyd protests ronen tweeted believed strongly san francisco police force needed reduced want make clear believe strongly defunding police reducing number officers force ronen wrote decades ’ imbalance city ’ budget hundreds millions dollars going sfpd work qualified san francisco criminal justice system rocked 'earthquake da activist says san francisco county sheriff office deputies pass sanctioned fenced-in homeless encampment across city hall san francisco may 19 2020 jane tyska / digital first media / east bay times via getty images 2020 mayor london breed redirected 120 million law enforcement fund city initiatives crime san francisco continued worsen homicides increasing 20 2020 compared 2019. homicides increased 17 2021 compared previous year.by december 2021 breed made emergency request board supervisors add funds city police department.the san francisco police department struggled lack staffing past years february officers responded burglary 15 hours 911 call made sfpd short-staffed response times negatively impacted result response time 12 hours call nature falls far short department ’ public ’ expectations officer robert rueca click appfox digital reached ronen office comment heard back.fox emma colton contributed report,politics,," March 19, 2023 5:18pm EDT",positive
6,"Millions of fish turn up dead in river, leaving homeowners holding their noses",https://www.foxnews.com/world/australian-river-filled-millions-dead-fish-residents-complain-putrid-smell,landmark nuclear submarine deal us australia uk sends message china former defense secretary mark esper praises project reacts president xi zelenskyy plan speak.residents small australian town holding noses stench millions dead fish washed recent weeks clogging major river residents outback town menindee south wales complained terrible smell dead fish resident local nature photographer told associated press nearly put mask millions dead fish clogged river near small australian town graeme mccrabb worried health water right comes pumping station town people north menindee say cod perch floating river everywhere said.new south wales ’ department primary industries believe depleted oxygen levels receding floods likely cause mass fish deaths situation compounded fish needing oxygen warmer weather.scientists revive ancient ‘ zombie viruses ’ siberian permafrost chan infect amoeba cellsmass fish kills reported darling-baaka river recent weeks well tens thousands fish found spot late february several reports dead fish downstream toward pooncarie near borders south australia victoria states.authorities established emergency operations center coordinate massive cleanup provide clean water residents state agencies started release higher-quality water possible boost dissolved oxygen levels area 've sort started clean happened sort 're walking around dried-up mess 're smelling putrid smell menindee resident jan dening terrible smell horrible see dead fish click appthe development comes weeks florida southwest coast experienced flare-up toxic red algae leading residents complain burning eyes skin thousands dead fish washed along shores sarah rumpf associated press contributed report bradford betz digital breaking reporter covering crime political issues much,world,," March 19, 2023 3:45pm EDT",negative
7,Tiger Woods' ex-wife makes it clear where she stands amid off-the-fairway drama,https://www.foxnews.com/sports/tiger-woods-ex-wife-no-interest-personal-life-lawsuit-ex-girlfriend-report,sports 19 sports check clicking foxnews.com.tiger woods middle lawsuits filed former girlfriend erica herman looking compensation allegedly kicked home living golfer underneath nondisclosure agreement signed.woods ’ ex-wife elin nordegren thoughts concerns ex-husband ’ lawsuit according people magazine source nordegren interest legendary golfer ’ personal life aspect tiger life concern source nordegren told magazine interest personal life happens various girlfriends part life long time ago click sports coverage foxnews.com tiger woods elin nordegren leave stage opening ceremonies ryder cup detroit michigan sept. 16 2004 a. messerschmidt/getty images woods nordegren part high-profile split 2010 woods revealed infidelity following single-vehicle crash near florida home kids together source told people tensions cooled recent years sake children would never go back likes good father seen years worked good relationship co-parent pretty well source told magazine course needs confident children safe happy around anyone tiger especially romance becomes serious source adds degree interested much else tiger woods elin nordgren watch 2004 ryder cup detroit a. messerschmidt/getty images tiger woods attorneys deny legendary golfer forced ex-girlfriend agree tenancy agreementsherman seeking 30 million jupiter irrevocable trust claimed agents trust used trickery leave house clamed oral tenancy agreement broken removed home.additionally herman seeks clarity ’ allowed say nda citing speak act says ’ confined nda speak act signed 2022 prohibits judicial enforceability nondisclosure clause nondisparagement clause agreed dispute arises involving sexual assault sexual harassment violation federal tribal state law elin nordegren watches tiger woods gallery arnold palmer invitational bay hill club lodge 14 2008 orlando florida scott a. miller/getty images click appwoods ’ lawyers say herman jilted ex-girlfriend speak act ’ apply case never alleged sexual abuse ryan gaydos senior editor digital,sports,," March 19, 2023 2:58pm EDT",positive
